{
  "$schema": "https://json-schema.org/draft/2020-12/schema",
  "title": "pstack-omp configuration",
  "type": "object",
  "additionalProperties": false,
  "properties": {
    "defaultMode": {
      "enum": [
        "off",
        "auto",
        "strict"
      ]
    },
    "writeAuditFiles": {
      "type": "boolean"
    },
    "enforceIndependentVerifier": {
      "type": "boolean"
    },
    "preferCrossFamilyVerifier": {
      "type": "boolean"
    },
    "requireEvidenceForPass": {
      "type": "boolean"
    },
    "requireArtifactFingerprint": {
      "type": "boolean"
    },
    "maxPolicyCharacters": {
      "type": "integer",
      "minimum": 1000
    },
    "maxStopGateBlocks": {
      "type": "integer",
      "minimum": 0,
      "description": "session_stop blocks per gate-only run. Omit for the mode default: strict 2, auto 0."
    },
    "auditDirectory": {
      "type": "string",
      "minLength": 1
    },
    "fingerprintIgnore": {
      "type": "array",
      "items": {
        "type": "string",
        "minLength": 1
      }
    },
    "maxWorkspaceFiles": {
      "type": "integer",
      "minimum": 1
    },
    "maxHashedFileBytes": {
      "type": "integer",
      "minimum": 1
    },
    "headlessOpenGateExitCode": {
      "type": "integer",
      "minimum": 0,
      "maximum": 125,
      "description": "Exit code for a headless OMP process that ends with open run gates or an over-budget unengaged change. 0 disables. Default 3."
    },
    "engagementTripwire": {
      "type": "boolean",
      "description": "In auto/strict, treat a session that changes more than the direct budget without opening a pstack run like open gates. Default true."
    },
    "directMaxFiles": {
      "type": "integer",
      "minimum": 0,
      "description": "Direct-change budget: changed files allowed without a run. Default 1."
    },
    "directMaxLines": {
      "type": "integer",
      "minimum": 0,
      "description": "Direct-change budget: added+deleted lines allowed without a run. Default 20."
    }
  }
}
